title,description,price,square,province,district,ward,post_date,num_bedrooms,num_toilets,num_floors,link,_ingestion_timestamp,_partition_province,_partition_year,_partition_month,_parsed_post_date,price_vnd,square_m2,post_date_parsed,title_clean,province_clean,district_clean,ward_clean,price_per_m2,has_price,has_square,has_location,quality_score,dedup_key
"GẤP > GẤP: BÁN GẤP NHÀ 3 TẦNG 3PN 4WC HOÀN CÔNG -  XE HƠI ĐẬU CỬA 24/24 GẦN CHỢ THỦ ĐỨC, ĐẶNG VĂN BI - GIÁ CỰC RẺ","Nhà 1 trệt 2 lầu, với thiết kế hiện đại, bao gồm 3 phòng ngủ rộng rãi và 4 toilet tiện nghi, sẵn sàng đáp ứng nhu cầu sinh hoạt của gia đình bạn. Sổ riêng hoàn công, đảm bảo tính pháp lý rõ ràng. Đây là không gian lý tưởng cho cuộc sống thoải mái và tiện nghi. Hãy đến xem và trải nghiệm ngay!",6 tỷ,50 m2,ho_chi_minh,Quận Thủ Đức,Trường Thọ,16/10/2025,3,4,3,https://bds.com.vn/gap---gap--ban-gap-nha-3-tang-3pn-4wc-hoan-cong----xe-hoi-dau-cua-2424-gan-cho-thu-duc-dang-van-bi---gia-cuc-re-p608780.html,2025-12-15T22:51:11.682766,ho_chi_minh,2025,10,2025-10-16T00:00:00,6000000000.0,50.0,2025-10-16,"gấp > gấp: bán gấp nhà 3 tầng 3pn 4wc hoàn công -  xe hơi đậu cửa 24/24 gần chợ thủ đức, đặng văn bi - giá cực rẻ",ho_chi_minh,Quận Thủ Đức,Trường Thọ,120000000.0,1,1,1,3,02a9fb89c29b4a98d9ea262d35805dfc
"BÁN NHÀ SIÊU ĐẸP 7 TẦNG BỒ ĐỀ - LONG BIÊN - Ô TÔ 7 CHỖ VÀO NHÀ - VỪA Ở VỪA KINH DOANH ĐƯỢC - MẶT NGÕ THÔNG - CHỈ 14,8 Tỷ","NHÀ ĐẸP 7 TẦNG - THANG MÁY - MẶT NGÕ THÔNG - Ô TÔ 7 CHỖ VÀO NHÀ - PHÙ HỢP KINH DOANH CHỈ 14,8 Tỷ+ Diện tích : 65 m2 + Mặt tiền : 6m+ Vị trí đắc địa, khu vực Víp hiếm có khó tìm, nhà cách mặt phố 20m, ngõ rộng 6m xe ô tô 7 chỗ vào nhà.
+ Nhà xây mới 7 tầng thang máy, nhà hoàn thiện đẹp về ở ngay, nội ngoại thất châu âu, phong cách hiện đại, ai mua về tiện ở hoặc làm nghề và KD nhỏ.
+ Ngõ thông ra nhìu tuyến phố lớn của Quận
- Diện tích tầng 1 là 63m2, từ tầng 2 đua ra được hơn 68m2.
- Tầng 1:  Kinh Doanh + Gara ô tô + 1 WC
- Tầng 2:  1 phòng khách rộng + 1 phòng bếp + 1 WC
- Tầng 3:  1 phòng ngủ rộng + 1 WC
- Tầng 4:  1 phòng ngủ rộng + 1 WC
- Tầng 5 - 2 Phòng ngủ rộng + 1 WC
- Tầng 6: 1 Phòng thờ
- Tầng 7: Sân vườn + sân phơi
+ Nội thất đầy đủ theo phong cách với hệ thống điện và báo cháy hiện đại nhất 2022 theo tiêu chí Châu Âu . Khách mua về chỉ việc vào ở
+ Sổ Đỏ vuông đẹp chính chủ
LH 0358785683  ĐỂ ĐƯỢC XEM NHÀ FREE - MIỄN TIẾP MÔI GIỚI !!!",14.8 tỷ,68 m2,ha_noi,Quận Long Biên,Phường Bồ Đề,16/10/2025,4,5,7,https://bds.com.vn/ban-nha-sieu-dep-7-tang-bo-de---long-bien---o-to-7-cho-vao-nha---vua-o-vua-kinh-doanh-duoc---mat-ngo-thong---chi-148-ty-p469284.html,2025-12-15T22:46:55.201223,ha_noi,2025,10,2025-10-16T00:00:00,14800000000.0,68.0,2025-10-16,"bán nhà siêu đẹp 7 tầng bồ đề - long biên - ô tô 7 chỗ vào nhà - vừa ở vừa kinh doanh được - mặt ngõ thông - chỉ 14,8 tỷ",ha_noi,Quận Long Biên,Phường Bồ Đề,217647058.82352942,1,1,1,3,058729866bac4e5a211094aef8b66de8
Bán nhà Cống Lở HXH 4m thẳng trục 48m2 4.55 tỷ .,"=> Nhà gồm : 1 trệt 1 lầu, 2 phòng ngủ, 2wc, bếp, phòng khách. Mới đẹp khách có thể vào ở ngay.=> Hẻm trước nhà 4m , thẳng 1 trục nhìn ra mặt tiền . An ninh sạch sẽ .=> Sổ đẹp ( 4mx12m ) , chính chủ , mua bán nhanh.",4.55 tỷ,48 m2,ho_chi_minh,Quận Tân Bình,Phường 15,16/10/2025,2,2,2,https://bds.com.vn/ban-nha-cong-lo-hxh-4m-thang-truc-48m2-455-ty--p453832.html,2025-12-15T16:30:48.981970,ho_chi_minh,2025,10,2025-10-16T00:00:00,4550000000.0,48.0,2025-10-16,bán nhà cống lở hxh 4m thẳng trục 48m2 4.55 tỷ .,ho_chi_minh,Quận Tân Bình,Phường 15,94791666.66666667,1,1,1,3,0955c84ad1c4552d0d08bccaf6caa0c7
BÁN NHÀ CẦU GIẤY NGÕ THÔNG  54m 3T GIÁ 5.85TỶ,"BÁN NHÀ CẦU GIẤY NGÕ THÔNG  54m 3T GIÁ 5.85TỶ . + Nhà có vị trí đẹp cách ô tô vài bước chân,ngõ thông rộng , rất gần phố , giao các phố Quan Hoa, Nguyễn Khánh Toàn, Bưởi, Nguyễn Đình Hoàn. Khu vực tiện ích ngập tràn không thiếu thứ gì, gần trường, chợ, siêu thị và nhiều tiện ích khác. Đường trước nhà xe máy tránh . Nhà thiết kế 3 tầng gồm có phòng khách, bếp, 3 phòng ngủ, 2 WC, phòng thờ và sân phơi + Sổ đỏ đẹp, Pháp lý rõ ràng giao dịch ngay + Liên hệ để xem nhà 0946648526.",5.85 tỷ,54 m2,ha_noi,Quận Cầu Giấy,Phường Dịch Vọng,16/10/2025,3,2,3,https://bds.com.vn/ban-nha-cau-giay-ngo-thong--54m-3t-gia-585ty-p484048.html,2025-12-15T22:47:22.127938,ha_noi,2025,10,2025-10-16T00:00:00,5850000000.0,54.0,2025-10-16,bán nhà cầu giấy ngõ thông  54m 3t giá 5.85tỷ,ha_noi,Quận Cầu Giấy,Phường Dịch Vọng,108333333.33333333,1,1,1,3,0a0551a03dc03217a9e803d39d9ff6c7
"Nhà đường Tân Xuân 3B, DT: 4x21m (công nhận 84m2) 1T+1Lửng","Nhà tôi tọa lạc tại đường Tân Xuân 3B, Hóc Môn, với diện tích 4x21m (công nhận 84m2). Ngôi nhà mới xây đẹp, thiết kế 1 tầng và 1 lửng, gồm 4 phòng ngủ thoáng mát, phù hợp cho gia đình đông người.

Vị trí nhà nằm trong khu dân cư yên tĩnh, bao quy hoạch, chỉ cách đường Tô Ký vài phút đi xe máy, thuận tiện di chuyển về Gò Vấp. Hẻm trước nhà rộng 5m, dễ dàng tiếp cận.

Sổ mới hoàn công đầy đủ, tôi hỗ trợ vay ngân hàng với lãi suất ưu đãi. Giá bán hiện tại là 3,2 tỷ. Mọi chi tiết xin vui lòng liên hệ qua số điện thoại để có cơ hội xem nhà. Cảm ơn quý khách đã quan tâm!",3.2 tỷ,85 m2,ho_chi_minh,Huyện Hóc Môn,Hóc Môn,16/10/2025,4,2,2,https://bds.com.vn/nha-duong-tan-xuan-3b-dt--4x21m-cong-nhan-84m2-1t1lung-p611560.html,2025-12-15T16:29:37.569369,ho_chi_minh,2025,10,2025-10-16T00:00:00,3200000000.0,85.0,2025-10-16,"nhà đường tân xuân 3b, dt: 4x21m (công nhận 84m2) 1t+1lửng",ho_chi_minh,Huyện Hóc Môn,Hóc Môn,37647058.823529415,1,1,1,3,0c5413193b626a07959c4171d2843445
Ô TÔ VÀO NHÀ - NGÕ TO THÔNG THOÁNG CÁCH MẶT PHỐ CHỈ 50M - NHÀ MỚI ĐẸP Ở LUÔN,"Ô TÔ VÀO NHÀ - NGÕ TO THÔNG THOÁNG CÁCH MẶT PHỐ CHỈ 50M - NHÀ MỚI ĐẸP Ở LUÔN

Ngõ3 Nhân Hoà: 34m2 - 5tầng - MT 5.6m - Giá 8.6 tỷ
+ Nhà trung tâm quận Thanh Xuân, ngõ cạnh trường cấp 2 Phan Đình Giót, thông thoáng ô tô vào nhà thoải mái
+ Khu vực vip nhất quận Thanh Xuân, gần chợ thuốc Hapulico, gần Quận Uỷ Thanh Xuân, phố Hoàng Đạo Thuý, Nguỵ Như Kom Tum, Vũ Trọng Phụng.
+ Khu vực dân trí cao ngút, tiện ích ngập tràn, gần nhiều trường học, trung tâm thương mại khu vui chơi giải trí, an sinh đỉnh.
+ Nhà chủ tự xây tâm huyết, nội thất sịn sò, sang trọng tiện nghi
- Tầng 1: Gara ô tô, bếp và wc.- Tầng 2: phòng khách và khu thờ phụng- Tầng 3: 1 phòng ngủ master rộng và wc- Tầng 4: 2 phòng ngủ và wc- Tầng 5: phòng ngủ và sân phơi",8.6 tỷ,34 m2,ha_noi,Quận Thanh Xuân,Phường Nhân Chính,16/10/2025,4,3,5,https://bds.com.vn/o-to-vao-nha---ngo-to-thong-thoang-cach-mat-pho-chi-50m---nha-moi-dep-o-luon-p462265.html,2025-12-15T22:46:29.161718,ha_noi,2025,10,2025-10-16T00:00:00,8600000000.0,34.0,2025-10-16,ô tô vào nhà - ngõ to thông thoáng cách mặt phố chỉ 50m - nhà mới đẹp ở luôn,ha_noi,Quận Thanh Xuân,Phường Nhân Chính,252941176.47058824,1,1,1,3,0d819d3a3cca3eaf8099fdd3736d8dc0
"Bán Nhà Kinh Doanh VP Nguyễn Chí Thanh, Đống Đa 55m, 8 tầng, mt 6.7m, giá 19.5 tỷ","Bán nhà kinh doanh văn phòng tại phố Nguyễn Chí Thanh, quận Đống Đa. Diện tích 55m2, 8 tầng, mặt tiền rộng 6.7m, giá chỉ 19.5 tỷ. Đây là một cơ hội tuyệt vời cho những ai đang tìm kiếm một vị trí đắc địa để phát triển kinh doanh. Liên hệ ngay với tôi, em Lan, qua số điện thoại 0975258510 để biết thêm chi tiết và sắp xếp lịch xem nhà.",19.50 tỷ,55 m2,ha_noi,Quận Đống Đa,Phường Láng Thượng,16/10/2025,5,5,8,https://bds.com.vn/ban-nha-kinh-doanh-vp-nguyen-chi-thanh-dong-da-55m-8-tang-mt-67m-gia-195-ty-p616719.html,2025-12-15T22:49:43.286705,ha_noi,2025,10,2025-10-16T00:00:00,19500000000.0,55.0,2025-10-16,"bán nhà kinh doanh vp nguyễn chí thanh, đống đa 55m, 8 tầng, mt 6.7m, giá 19.5 tỷ",ha_noi,Quận Đống Đa,Phường Láng Thượng,354545454.54545456,1,1,1,3,0df48403aa18e2a2d150be7dcdffb1ac
"Nhà Đẹp Ngõ Ô TÔ Trương Định, Hoàng Mai 54m, 4 tầng, mt 3.8m, giá 10.5 tỷ.","Nhà đẹp nằm trong ngõ ô tô Trương Định, Hoàng Mai với diện tích 54m2, xây dựng 4 tầng và mặt tiền 3.8m, giá chỉ 10.5 tỷ.

Nhà mới hoàn toàn, ô tô đỗ cửa thuận tiện, trang bị đầy đủ nội thất cao cấp. Kiến trúc hiện đại với mỗi tầng gồm 2 phòng rộng rãi, vệ sinh khép kín và ánh sáng tự nhiên tràn ngập. Nội thất được trang bị điều hòa Daikin nhập khẩu từ Thái, thiết bị bếp Boss, gạch lát Tây Ban Nha, cùng với giường tủ và sofa nhập khẩu chất lượng cao.

Chi phí xây dựng và hoàn thiện đã lên tới gần 4 tỷ, khách hàng chỉ cần dọn vào ở ngay. Vị trí nhà cực kỳ thuận lợi, nằm cách đường ô tô tránh nhau chỉ 15m và gần các ngã tư Tân Mai, Trương Định, Hồ Đền Lừ.

Sổ đỏ đẹp, sẵn sàng cho giao dịch. Liên hệ ngay em Lan qua số điện thoại 0975258510 để biết thêm thông tin chi tiết.",10.50 tỷ,54 m2,ha_noi,Quận Hoàng Mai,Phường Tân Mai,16/10/2025,5,3,4,https://bds.com.vn/nha-dep-ngo-o-to-truong-dinh-hoang-mai-54m-4-tang-mt-38m-gia-105-ty-p616697.html,2025-12-15T22:46:05.254821,ha_noi,2025,10,2025-10-16T00:00:00,10500000000.0,54.0,2025-10-16,"nhà đẹp ngõ ô tô trương định, hoàng mai 54m, 4 tầng, mt 3.8m, giá 10.5 tỷ.",ha_noi,Quận Hoàng Mai,Phường Tân Mai,194444444.44444445,1,1,1,3,0f5660048d1b39255753a4424bc96ab1
"HXH Hà Huy Giáp 82m2 NGANG 5M, hẻm thẳng 1 trục, ngay ngã tư Ga","- Cần bán nhà Quận 12 ngay cầu vượt ngã tư Ga để trả nợ ngân hàng

- Diện tích 82m2 (5x16.2) vuông vức

- Nhà C4 có 2 mặt hẻm trước và sau, hẻm thẳng 1 trục xe hơi đậu được trong nhà

- Một bước chân ra Hà Huy Giáp, cầu vượt Ngã tư Ga về Nguyễn Oanh Gò Vấp, Bình Thạnh

- Khu vực an ninh, yên tĩnh, hàng xóm hiền lành, thân thiện

- Pháp lý chuẩn, sổ vuông sẵn sàng công chứng

GỌI NGAY: 0931 434 456 gặp Nam Nhà Phố để nhận hỗ trợ TƯ VẤN miễn phí, xem và gặp CHÍNH CHỦ thương lượng, lựa chọn nhiều nhà đất RẺ, ĐẸP theo nhu cầu",3.95 tỷ,82 m2,ho_chi_minh,Quận 12,Thạnh Xuân,16/10/2025,2,1,1,https://bds.com.vn/hxh-ha-huy-giap-82m2-ngang-5m-hem-thang-1-truc-ngay-nga-tu-ga-p469243.html,2025-12-15T16:32:07.773837,ho_chi_minh,2025,10,2025-10-16T00:00:00,3950000000.0,82.0,2025-10-16,"hxh hà huy giáp 82m2 ngang 5m, hẻm thẳng 1 trục, ngay ngã tư ga",ho_chi_minh,Quận 12,Thạnh Xuân,48170731.70731708,1,1,1,3,10582b175d315b1f2b952b4e980a0a33
Bán nhà Hoa Bằng 5T TT Cầu Giấy. 48m2 KD đỉnh. Ngõ thông 3 bước chân ra ô tô tránh.,"Nhà mới xây tại Hoa Bằng, diện tích 48m², 5 tầng, mặt ngõ thông kinh doanh tuyệt vời, chỉ cách ô tô tránh 3 bước chân. Đây là cơ hội hiếm có với giá 9 tỷ 9, không có căn thứ hai trong tầm giá này!

Mô tả chi tiết:
- Vị trí đắc địa, gần chợ, ngõ thông thoáng, dễ dàng di chuyển.
- Ngõ trước nhà rộng 3m, thoáng đãng.
- Diện tích 48m² với mặt tiền 4,9m, thiết kế hợp lý:
- Tầng 1: Khu vực kinh doanh + Bếp + WC.
- Tầng 2: Phòng khách + 1 phòng ngủ.
- Tầng 3 và 4: Mỗi tầng gồm 2 phòng ngủ + WC.
- Tầng 5: Phòng thờ + Sân phơi rộng rãi.

Giá 9 tỷ 9, có thương lượng cho khách hàng thiện chí. Sổ đỏ chính chủ, giao dịch ngay trong ngày. Liên hệ với tôi để lên lịch xem nhà!",9.9 tỷ,48 m2,ha_noi,Quận Cầu Giấy,Phường Yên Hoà,16/10/2025,5,5,5,https://bds.com.vn/ban-nha-hoa-bang-5t-tt-cau-giay-48m2-kd-dinh-ngo-thong-3-buoc-chan-ra-o-to-tranh-p616419.html,2025-12-15T22:46:05.255405,ha_noi,2025,10,2025-10-16T00:00:00,9900000000.0,48.0,2025-10-16,bán nhà hoa bằng 5t tt cầu giấy. 48m2 kd đỉnh. ngõ thông 3 bước chân ra ô tô tránh.,ha_noi,Quận Cầu Giấy,Phường Yên Hoà,206250000.0,1,1,1,3,118f39eaca0b7955d63a5b04fd80eaaa
"MẶT TIỀN HÀ ĐẶC, TRUNG MỸ TÂY, Q12- KINH DOANH CỰC TỐT-GIÁ CHỈ NHỈNH 5 TỶ.","Nhà mặt tiền đường Hà Đặc, nằm ngay đoạn sôi động của chợ Chó, nơi giao thương tấp nập. Với kết cấu 4 tầng, căn nhà này bao gồm 4 phòng ngủ, 3 phòng vệ sinh và sân thượng rộng rãi ở cả phía trước và phía sau, mang đến không gian sống thoải mái và tiện nghi.

Vị trí của nhà cực kỳ đắc địa tại phường Trung Mỹ Tây, xung quanh là các tiện ích thiết yếu như chợ, siêu thị, Bách Hoá Xanh, VinMart, cùng nhiều trường học từ mầm non đến cấp 3 và 5 trường Cao đẳng, Đại học. Hơn nữa, khu vực còn tập trung nhiều ngân hàng, thuận tiện cho các giao dịch tài chính.

Căn nhà lý tưởng này không chỉ phục vụ nhu cầu ở mà còn rất thích hợp cho việc kinh doanh, mở rộng cơ hội phát triển trong một khu vực đầy tiềm năng.",5.70 tỷ,52 m2,ho_chi_minh,Quận 12,Trung Mỹ Tây,16/10/2025,4,3,4,https://bds.com.vn/mat-tien-ha-dac-trung-my-tay-q12--kinh-doanh-cuc-tot-gia-chi-nhinh-5-ty-p611477.html,2025-12-15T16:29:08.123345,ho_chi_minh,2025,10,2025-10-16T00:00:00,5700000000.0,52.0,2025-10-16,"mặt tiền hà đặc, trung mỹ tây, q12- kinh doanh cực tốt-giá chỉ nhỉnh 5 tỷ.",ho_chi_minh,Quận 12,Trung Mỹ Tây,109615384.61538461,1,1,1,3,121f4e38d1c69e320ef332fac689da58
NHÀ MỚI TINH - 3 NGỦ - NGÕ RỘNG THOÁNG - 5P LÊN PHỐ - TRUNG TÂM HAI BÀ TRƯNG,"Nhà mới tinh, thiết kế hiện đại với 3 phòng ngủ rộng rãi, không gian thoáng đãng. Ngõ rộng, thuận tiện di chuyển, chỉ mất 5 phút để vào trung tâm phố. Vị trí đắc địa tại quận Hai Bà Trưng, gần nhiều tiện ích như trường học, chợ, và các dịch vụ khác. Đây là nơi lý tưởng để tận hưởng cuộc sống thoải mái và tiện nghi. Hãy đến tham quan để cảm nhận không gian sống tuyệt vời này!",5.8 tỷ,34 m2,ha_noi,Quận Hai Bà Trưng,Phường Thanh Nhàn,16/10/2025,3,4,5,https://bds.com.vn/nha-moi-tinh---3-ngu---ngo-rong-thoang---5p-len-pho---trung-tam-hai-ba-trung-p616640.html,2025-12-15T16:26:36.738176,ha_noi,2025,10,2025-10-16T00:00:00,5800000000.0,34.0,2025-10-16,nhà mới tinh - 3 ngủ - ngõ rộng thoáng - 5p lên phố - trung tâm hai bà trưng,ha_noi,Quận Hai Bà Trưng,Phường Thanh Nhàn,170588235.29411766,1,1,1,3,1497c535545d7ccc19ae7f9b4c864c44
"Hiếm, bán nhà Phố Triệu Việt Vương, Nguyễn Du, 7 TÂNG, Gara ô tô, Thang máy, 70m2. 26 Tỷ.","TRIỆU VIỆT VƯƠNG – NGUYỄN DU – HAI BÀ TRƯNG – 7 TẦNG –  THANG MÁY – GARA Ô TÔ – FULL NỘI THẤT – KINH DOANH - Ở ĐẲNG CẤP.
- HOÀNG HƯNG - 0916.113.179 – BÁN NHÀ BẰNG SỰ TỬ TẾ.
+ Vị trí ĐẸP ngay ngã 4 Triệu Việt Vương giao Nguyễn Du, giao thông thuận lợi, vài bước chân ra Hồ Hoàn Kiếm, phố đi bộ...
+ Nhà 7 tầng, thang máy, chủ nhà cán bộ nhà nước về hưu xây nhà cực kỳ tâm huyết, chăm chút từng chi tiết nhỏ, Nội thất chủ đạo là Gỗ, trang thiết bị cao cấp.
+ Nhà Sáng Trước – Thoáng Sau, thiết kế 02 giếng trời nên Phòng nào cũng có Ánh sáng tự nhiên, thoáng mát, thiết kế: T1,2 thông sàn, các tầng còn lại thiết kế cơ bản tầng 02 phòng Master.
+ Sổ đỏ chính chủ, sẵn sàng giao dịch.
+ Giá bán: 26 tỷ ( có thương lượng ).
Liên hệ trực tiếp 24/7 để đi xem nhà miễn phí.
- Hoàng Hưng 0916.113.179 – BÁN NHÀ BẰNG SỰ TỬ TẾ.
- Chuyên Nhà đất Hoàn Kiếm, Ba Đình, Tây Hồ. “CHỈ CẦN QUÝ KHÁCH CÓ NHU CẦU _ VIỆC CÒN LẠI HÃY ĐỂ CHÚNG TÔI”",26 tỷ,70 m2,ha_noi,Quận Hai Bà Trưng,Phường Nguyễn Du,16/10/2025,7,7,7,https://bds.com.vn/hiem-ban-nha-pho-trieu-viet-vuong-nguyen-du-7-tang-gara-o-to-thang-may-70m2-26-ty-p462239.html,2025-12-15T22:46:30.513235,ha_noi,2025,10,2025-10-16T00:00:00,26000000000.0,70.0,2025-10-16,"hiếm, bán nhà phố triệu việt vương, nguyễn du, 7 tâng, gara ô tô, thang máy, 70m2. 26 tỷ.",ha_noi,Quận Hai Bà Trưng,Phường Nguyễn Du,371428571.4285714,1,1,1,3,15e3ce9963de4b8e97d1c0595986e755
TÂN HƯNG - QUẬN 4 - XE HƠI VÀO NHÀ - KHU VỰC SẦM UẤT VÀ ĐÁNG SỐNG BẬC NHẤT QUẬN 7,"Nhà đẹp cần bán, nằm trong hẻm xe hơi đỗ cửa, rất thuận tiện cho việc di chuyển.

Với diện tích 3 x 8m, ngôi nhà được thiết kế hiện đại với 1 trệt, 2 lầu và sân thượng thoáng mát. Bên trong, bạn sẽ tìm thấy 2 phòng ngủ rộng rãi và 3 nhà vệ sinh tiện nghi, đáp ứng đầy đủ nhu cầu sinh hoạt của gia đình.

Hẻm rộng rãi, ô tô có thể ra vào thoải mái, mang lại sự thuận tiện cho cuộc sống hàng ngày. Đây là cơ hội tuyệt vời cho những ai đang tìm kiếm một chốn an cư lý tưởng.",6 tỷ,70 m2,ho_chi_minh,Quận 4,Phường 4,16/10/2025,4,5,4,https://bds.com.vn/tan-hung---quan-4---xe-hoi-vao-nha---khu-vuc-sam-uat-va-dang-song-bac-nhat-quan-7-p609021.html,2025-12-15T16:29:40.519330,ho_chi_minh,2025,10,2025-10-16T00:00:00,6000000000.0,70.0,2025-10-16,tân hưng - quận 4 - xe hơi vào nhà - khu vực sầm uất và đáng sống bậc nhất quận 7,ho_chi_minh,Quận 4,Phường 4,85714285.71428572,1,1,1,3,1aea0e38e626fab18200eb017c7a1575
"Bán Nhà Mới Đường Số 53. P Tân Quý. 72m2. 4 Tầng. Chỉ 11,9 Tỷ","Tại sao anh chị lại nên quan tâm xem xét và mua sở hữu tài sản này. thứ nhất: vị trí ngay Phường Tân Quy, Quận 7,
thứ 1: Ví trí phương Trung tâm Quận 7. đường 14m rộng rãi
thứ 2: Vị trí ngay Siêu thị Lotte Mart. ngay chợ chiều Tân Quy.
thứ 3: diện tích đất rộng rái. xây dựng thoáng. ngang 4m, dài 18m.
thứ 4: Hiện trang 4 tầng kiên cố, chắc chắn. 5pn, 5wc. phòng khách rộng, bếp rộng, gara xe hơi
thứ 5: pháp lý thì rõ ràng, sổ hồng đầy đủ, không bị quy hoạch gì khác.
thứ 6: gia chủ thiện trí bán. gia chủ thân thiện, hòa nhã.
thứ 7: giá bán tốt hiện nay: 11 tỷ 9 tỷ. Bớt lộc
thứ 8: vị trí này ở hay chon thuê đều rất phù hợp.
- Lh sớm để xem nhà ạ. 0962988143
- Chân thành cảm ơn anh chị đã tin tưởng xem tin và gửi gắm niềm tin nơi em.
+ Tiện ích:
- Căn nhà nằm ở vị trí trung tâm Quận 7, 5 phút vào Phú Mỹ Hưng. Kết nối trực tiếp với các đường Nguyễn Thị Thập, Nguyễn Lương Bằng, lâm Văn Bền. Tân Mỹ. Huỳnh Tấn Phát, Lê Văn Lương.
- 10 phút là tới tất cả các quận trung tâm Quận 1, Quận 3, Quận 4, Quận 2, Nhà Bè, Quận 9, Quận 5.
- Trong bán kính 1 km đầy đủ tiện ích Siêu thị Lotte, Vivo City, Big C, Crescent Mall, Chợ Tân Mỹ. Bệnh viện quận 7, bệnh viên tim Tâm Đức, bệnh viện FV. Hệ thống trường công lập, và trường quốc tế dày đặc. Như Đại học Tôn Đức Thắng, Đại học Tài chính - Maketing, Đại học RMIT...",11.9 tỷ,72 m2,ho_chi_minh,Quận 7,Tân Quy,16/10/2025,5,5,4,https://bds.com.vn/ban-nha-moi-duong-so-53-p-tan-quy-72m2-4-tang-chi-119-ty-p484834.html,2025-12-15T16:31:25.198085,ho_chi_minh,2025,10,2025-10-16T00:00:00,11900000000.0,72.0,2025-10-16,"bán nhà mới đường số 53. p tân quý. 72m2. 4 tầng. chỉ 11,9 tỷ",ho_chi_minh,Quận 7,Tân Quy,165277777.7777778,1,1,1,3,1c416b9c628374ae03ea5384d4f71fa9
"Bán nhà Phạm Văn Hai, P3, Tân Bình 48m2, nở hậu, 4 tầng, HXH, giá 4,1 tỷ TL","Thông tin mô tả:+ Tặng toàn bộ nội thất cao cấp, dọn vào ở ngay.+ Diện tích nhà lớn 48m2, nở hậu tài lộc.+ Kết cấu tường gạch, mái tôn, không gian rộng, mang tới sự sang trọng, quý phái.+ Thiết kế 1 trệt 2 lầu, sân  thượng theo phong cách hiện đại, phóng khoáng, thích hợp với gia đình trẻ.+ Vị trí không thể tuyệt vời hơn, gần đường Lê Văn Sỹ, Bùi Thị Xuân nhộn nhịp, sầm uất chỉ vài bước chân.+ Hẻm ô tô, sạch sẽ, thông thoáng, khu dân cư văn minh, camera giám sát an ninh đảm bảo 24/24.+ Tiện ích xung quanh không thiếu thứ gì, thuận tiện di chuyển, nút giao giữa quận 10, quận 1, Phú Nhuận.+ 7 phút qua Sân bay quốc tế Tân Sơn Nhất.+ Phù hợp mua ở hoặc cho thuê đem lại giá trị lợi nhuận cao.+ Pháp lý chuẩn, hoàn công đầy đủ, sang tên ngay.
Giá bán chỉ 4,1 tỷ (còn thương lượng).Liên hệ 0392459416 - Bé Út nhà phố để xem nhà và tư vấn ngân hàng hoàn toàn miễn phí.",4.1 tỷ,48 m2,ho_chi_minh,Quận Tân Bình,Phường 13,16/10/2025,4,3,4,https://bds.com.vn/ban-nha-pham-van-hai-p3-tan-binh-48m2-no-hau-4-tang-hxh-gia-41-ty-tl-p466431.html,2025-12-15T16:30:07.516628,ho_chi_minh,2025,10,2025-10-16T00:00:00,4099999999.9999995,48.0,2025-10-16,"bán nhà phạm văn hai, p3, tân bình 48m2, nở hậu, 4 tầng, hxh, giá 4,1 tỷ tl",ho_chi_minh,Quận Tân Bình,Phường 13,85416666.66666666,1,1,1,3,1deafbf9783f7b693ae9a1961520f13c
Bán nhà phố Khương Đình quận Thanh Xuân ngõ thoáng 1 phút đi bộ ra hồ Hạ Đình 46m2 5 tầng 5.2 tỷ,"KHƯƠNG ĐÌNH: NHÀ ĐẸP CHẤT - KHU VỰC TỐT - TIỆN ÍCH NHIỀU - GIÁ HỢP LÝ - THÍCH HỢP NHIỀU ĐỐI TƯỢNG KHÁCH HÀNG*** Mô Tả- Nhà 5T mới tinh, đẹp lung linh... Thiết kế hiện đại, nhiều phòng... Phù hợp với nhiều đối tượng khách hàng- Hướng: ĐTT- Ngõ nghách thông thoáng. Cách oto 75-80m. 1' đi bộ ra Hồ Hạ Đình... Khu vực Đáng sống và nhiều tiện ích bậc nhất Thanh Xuân... *** Thiết Kế- T1: Xe, Khách, bếp, VS- T2,3,4: Tầng 2P + VS- T5: Phòng thờ, sân phơi...
*** Tổng Quan- Nhà đẹp chất, Khu vực tốt, tiện ích nhiều, giá chào hợp lý. Thích hợp nhiều Đối tượng khách hàng.- Sổ đỏ vuông đẹp sẵn sàng giao dịchLiên hệ Ngọc Anh 0982832991",5.2 tỷ,46 m2,ha_noi,Quận Thanh Xuân,Phường Hạ Đình,16/10/2025,6,4,5,https://bds.com.vn/ban-nha-pho-khuong-dinh-quan-thanh-xuan-ngo-thoang-1-phut-di-bo-ra-ho-ha-dinh-46m2-5-tang-52-ty-p462327.html,2025-12-15T22:46:27.739821,ha_noi,2025,10,2025-10-16T00:00:00,5200000000.0,46.0,2025-10-16,bán nhà phố khương đình quận thanh xuân ngõ thoáng 1 phút đi bộ ra hồ hạ đình 46m2 5 tầng 5.2 tỷ,ha_noi,Quận Thanh Xuân,Phường Hạ Đình,113043478.26086956,1,1,1,3,20eefd1c2ee1818b92e7e813574be0cc
bán nhà quận bình tân  . nhà mới có sổ đỏ giá rẻ,"Đường Lê Trọng Tấn, Phường Bình Hưng Hòa, Quận Bình Tân, Tp Hồ Chí MinhXem bản đồ - Kết cấu: 1 trệt 2 lầu, có sân thượng, nhà xây mới đường Phạm Đăng Giảng, Bình Tân- Diện tích 5x8 full thổ cư không quy hoạch.- Nhà xây theo phong cách hiện đại gồm 1 phòng khách, 1 bếp, 4 phòng ngủ, sân để xe, 3 toilet... Trong nhà đều được trang bị các nội thất cao cấp.- Giá : 2,449 Tỷ TL.- Pháp lý sổ hồng riêng đã hoàn công xong xuôi.Anh chị quan tâm vui lòng liên hệ số Hotline, báo 15p trước khi xem nhà, miễn tiếp môi giới, cò lái.
Nhấn để hiện số: 0903698322",2.449 tỷ,40 m2,ho_chi_minh,Quận Bình Tân,Bình Hưng Hòa,16/10/2025,4,3,3,https://bds.com.vn/ban-nha-quan-binh-tan---nha-moi-co-so-do-gia-re-p481076.html,2025-12-15T16:31:42.242638,ho_chi_minh,2025,10,2025-10-16T00:00:00,2449000000.0,40.0,2025-10-16,bán nhà quận bình tân  . nhà mới có sổ đỏ giá rẻ,ho_chi_minh,Quận Bình Tân,Bình Hưng Hòa,61225000.0,1,1,1,3,21c051a2467cdf3f7309644c342f102d
