title,description,price,square,province,district,ward,post_date,num_bedrooms,num_toilets,num_floors,link,_ingestion_timestamp,_partition_province,_partition_year,_partition_month,_parsed_post_date,price_vnd,square_m2,post_date_parsed,title_clean,province_clean,district_clean,ward_clean,price_per_m2,has_price,has_square,has_location,quality_score,dedup_key
"Gần chợ Bưởi, 58m2, 4T, MT 4m, Oto đỗ gần, Lô góc, nhà đẹp ở sướng, nhỉnh 8 tỷ.","Nhà bán tại Lạc Long Quân, Cầu Giấy, vị trí đắc địa ngay sát Chợ Bưởi, chỉ cách 20m đến đường ô tô và chỉ mất 5 phút đi bộ để ra hồ Tây thoáng mát.

Diện tích 58m2, 4 tầng được xây dựng kiên cố, thiết kế 4 phòng ngủ tiện nghi. Nội thất trong nhà sạch sẽ, gọn gàng và thoáng đãng, trước nhà luôn có không gian thông thoáng.

Khu vực dân trí cao, giao thông thuận lợi, dễ dàng di chuyển đến các tuyến đường lớn như Hoàng Quốc Việt, Võ Chí Công, Thụy Khuê,…

Sổ đỏ chính chủ, giá cả có thể thương lượng trực tiếp.

Liên hệ ngay với tôi, em Phong, để xem nhà. Số điện thoại: 0795096899.",8.9 tỷ,58 m2,ha_noi,Quận Cầu Giấy,Phường Nghĩa Đô,16/10/2025,4,4,4,https://bds.com.vn/gan-cho-buoi-58m2-4t-mt-4m-oto-do-gan-lo-goc-nha-dep-o-suong-nhinh-8-ty-p616769.html,2025-12-15T16:28:02.282194,ha_noi,2025,10,2025-10-16T00:00:00,8900000000.0,58.0,2025-10-16,"gần chợ bưởi, 58m2, 4t, mt 4m, oto đỗ gần, lô góc, nhà đẹp ở sướng, nhỉnh 8 tỷ.",ha_noi,Quận Cầu Giấy,Phường Nghĩa Đô,153448275.86206895,1,1,1,3,b21124a2638d5f45ef231fa6d275fdf6
"Bán nhà  4 tầng, hẻm xe hơi vào nhà, đường Tây Lân, Quận Bình Tân, 51m2, 3PN, giá chỉ 5 tỷ 6","Bán nhà khu phân lô - không lộ giới  - TÂY LÂN - BÌNH TÂN ( Bình Trị Đông A), đường nhựa 5m , có vỉa hè.
51m2= 7x7.5m - 4 tầng - 3PN - chỉ 5 tỷ 6
Liên hệ (THỦY 0898780743) xem nhà và gặp chủ trực tiếp thương lượng",5.60 tỷ,51 m2,ho_chi_minh,Quận Bình Tân,Bình Trị Đông A,16/10/2025,3,4,4,https://bds.com.vn/ban-nha--4-tang-hem-xe-hoi-vao-nha-duong-tay-lan-quan-binh-tan-51m2-3pn-gia-chi-5-ty-6-p484855.html,2025-12-15T16:31:26.056692,ho_chi_minh,2025,10,2025-10-16T00:00:00,5600000000.0,51.0,2025-10-16,"bán nhà  4 tầng, hẻm xe hơi vào nhà, đường tây lân, quận bình tân, 51m2, 3pn, giá chỉ 5 tỷ 6",ho_chi_minh,Quận Bình Tân,Bình Trị Đông A,109803921.56862745,1,1,1,3,b3593cb938b1ca5d455dd71d564ca2af
MẶT PHỐ HUỲNH THÚC KHÁNG - ĐỐNG ĐA - 30M2 X 4T - PHÂN LÔ - VỈA HÈ 0 TÔ TRÁNH - KINH SẦM UẤT - NHỈNH 11 TỶ - CHO THUÊ DÒNG TIỀN 20TR/THG,"Mặt phố Huỳnh Thúc Kháng, Đống Đa, với diện tích 30m2 và thiết kế 4 tầng, là một cơ hội kinh doanh không thể bỏ qua. Vị trí ngôi nhà nằm trong khu phân lô đẹp nhất quận, chỉ cách mặt phố 15m, thuận tiện cho việc di chuyển và kinh doanh.

Ngõ rộng rãi, ô tô đỗ tránh, vỉa hè thoáng đãng, là nơi lý tưởng để phát triển các loại hình kinh doanh. Đường phố sầm uất, kết nối dễ dàng với các tuyến phố lớn như Nguyên Hồng, Trúc Khê, và Hoàng Ngọc Phách.

Nhà được thiết kế hợp lý với mỗi tầng có một phòng vệ sinh, chỉ cần thêm một lớp sơn là có thể trở nên lung linh. Hiện tại, nhà đang cho thuê với mức giá 20 triệu/tháng, mang lại dòng tiền ổn định cho chủ sở hữu.

Sổ đỏ phân lô rõ ràng, sẵn sàng cho giao dịch ngay. Nếu bạn đang tìm kiếm một bất động sản có tiềm năng sinh lời cao, hãy liên hệ ngay để biết thêm chi tiết.",11.5 tỷ,30 m2,ha_noi,Quận Đống Đa,Phường Láng Thượng,16/10/2025,3,3,4,https://bds.com.vn/mat-pho-huynh-thuc-khang---dong-da---30m2-x-4t---phan-lo---via-he-0-to-tranh---kinh-sam-uat---nhinh-11-ty---cho-thue-dong-tien-20trthg-p616235.html,2025-12-15T22:46:12.848249,ha_noi,2025,10,2025-10-16T00:00:00,11500000000.0,30.0,2025-10-16,mặt phố huỳnh thúc kháng - đống đa - 30m2 x 4t - phân lô - vỉa hè 0 tô tránh - kinh sầm uất - nhỉnh 11 tỷ - cho thuê dòng tiền 20tr/thg,ha_noi,Quận Đống Đa,Phường Láng Thượng,383333333.3333333,1,1,1,3,b3e8a050747f3685776ceb77a9923111
"Bán nhà khu kiều đàm đường Trần Xuân Soạn, nhà đẹp vào ở ngay Q7","Bán nhà khu kiều đàm đường Trần Xuân Soạn, nhà đẹp vào ở ngay- Nhà ngay khu tiện ích, chợ, trường học,... đầy đủ- Diện tích phù hợp cho gia đình 2 thế hệ, vợ chồng con cái- Sổ đẹp, hoàn công, công chứng ngay trong ngày- Hỗ trợ xem nhà miễn phí☎ Mr Hòa 0909127160",2.3 tỷ,21 m2,ho_chi_minh,Quận 7,Tân Hưng,16/10/2025,1,1,2,https://bds.com.vn/ban-nha-khu-kieu-dam-duong-tran-xuan-soan-nha-dep-vao-o-ngay-q7-p459430.html,2025-12-15T16:30:37.284039,ho_chi_minh,2025,10,2025-10-16T00:00:00,2300000000.0,21.0,2025-10-16,"bán nhà khu kiều đàm đường trần xuân soạn, nhà đẹp vào ở ngay q7",ho_chi_minh,Quận 7,Tân Hưng,109523809.52380952,1,1,1,3,b4ca3eda41b8712fada431160bd44a0b
"Biệt Thự gần 500m2, Tìm Chủ mới . giá 38 tỷ.","+ Biệt thự với thiết kế sang trọng, đẳng cấp.+ Diện tích:  12 x 40m+ Kết cấu: 3 Tầng với 5 phòng ngủ master, 5 tolet,  phòng khách rộng rãi, phòng làm việc, phòng tập thể dục, bếp, 2 sân thượng.+ Mặt tiền đường Vườn Lài.+ Pháp lý vuông như A4, công nhận đủ, chủ thiện chí.Giang (18++) xem nhà ngay.",38 tỷ,480 m2,ho_chi_minh,Quận 12,An Phú Đông,16/10/2025,5,5,3,https://bds.com.vn/biet-thu-gan-500m2-tim-chu-moi--gia-38-ty-p452434.html,2025-12-15T16:33:04.010114,ho_chi_minh,2025,10,2025-10-16T00:00:00,38000000000.0,480.0,2025-10-16,"biệt thự gần 500m2, tìm chủ mới . giá 38 tỷ.",ho_chi_minh,Quận 12,An Phú Đông,79166666.66666667,1,1,1,3,b56051535a40402c043315a1b8745038
"BÁN NHÀ NGỌC LÂM 45M2 XÂY 5 TẦNG,NHÀ SIÊU ĐẸP,FULL NỘI THẤT XIN SÒ,OTO 7 CHỖ ĐỖ CỬA","MÔ TẢ:+ Nhà cách mặt phố Ngọc Lâm  vài bước chân. Ngõ trước nhà ô tô 7 chỗ đỗ cửa.+ Vị trí đẹp, gần phố, cách Mipec Long Biên và cầu Chương Dương 100m.+ Cầu thang cuối, mỗi tầng 1 phòng ngủ rộng rãi, ban công thoáng mát.- Tầng 1: Phòng khách chủ hiện đang để trưng bầy sản phầm kinh doanh và để xe.- Tầng 2: Chủ đang làm phòng khách và đồ trưng bầy, khách mua về có thể chuyển sang thành phòng ngủ.- Tầng 3.4: mỗi tầng 1 phòng ngủ.- Tầng 5: bếp, sân phơi.
+ Chủ nhà cẩn thận kỹ tính, giữ nhà rất sạch sẽ. Hàng xóm thân thiện, an ninh tốt.",6.5 tỷ,45 m2,ha_noi,Quận Long Biên,Phường Ngọc Lâm,16/10/2025,3,3,5,https://bds.com.vn/ban-nha-ngoc-lam-45m2-xay-5-tangnha-sieu-depfull-noi-that-xin-sooto-7-cho-do-cua-p452374.html,2025-12-15T22:46:05.255938,ha_noi,2025,10,2025-10-16T00:00:00,6500000000.0,45.0,2025-10-16,"bán nhà ngọc lâm 45m2 xây 5 tầng,nhà siêu đẹp,full nội thất xin sò,oto 7 chỗ đỗ cửa",ha_noi,Quận Long Biên,Phường Ngọc Lâm,144444444.44444445,1,1,1,3,b7d3ea3099a5276ed52842f2794134d9
"Nhà bán hẻm xe tải quay đầu Dạ Nam trệt+3 lầu P2 Q8 giá 5,5 tỷ","Nhà bán hẻm xe tải quay đầu Dạ Nam trệt+3 lầu P2 Q8 giá 5,5 tỷ
- Diện tích: 3 x 11m. Dt đất xd: 32m2
- Kết cấu: Trệt + 3 lầu đúc BTCT. 3PN, 3WC. Nhà mới đẹp, dọn vào ở ngay.
- Vị trí: Cách cầu Chữ Y 100m, gần chợ Rạch Ông, 2 phút qua cầu Nguyễn Văn Cừ.
- Tiện ích: Có sân riêng đậu xe ôtô, nhà không lộ giới. Qua các quận trung tâm nhanh chóng.
- Hướng: Tây Bắc
- Pháp lý: Sổ hồng
- Giá : 5.5 Tỷ (TL ít)
*** Hỗ Trợ Vay Ngân Hàng 70% Giá Trị Nhà **
Liên hệ: 0933 083 116 – Ms Thùy
Web : www.muabannhasg.com
Công Ty Bất Động Sản Tâm Điền
Địa chỉ : 774 đường Hưng Phú, Phường 10, Quận 8
Nhận Ký Gửi Nhà Đất Các Quận TP.HCM",5.5 tỷ,32 m2,ho_chi_minh,Quận 8,Phường 12,16/10/2025,3,3,4,https://bds.com.vn/nha-ban-hem-xe-tai-quay-dau-da-nam-tret3-lau-p2-q8-gia-55-ty-p465118.html,2025-12-15T16:30:14.521555,ho_chi_minh,2025,10,2025-10-16T00:00:00,5500000000.0,32.0,2025-10-16,"nhà bán hẻm xe tải quay đầu dạ nam trệt+3 lầu p2 q8 giá 5,5 tỷ",ho_chi_minh,Quận 8,Phường 12,171875000.0,1,1,1,3,b9940e84620202a5f71397868b033afc
"Chính chủ đang vay ngân hàng cần bán gấp nền biệt thự ven sông Q8, có sổ riêng, bán cắt lỗ 2 tỷ","Cần bán nền đất biệt thự tại KDC Phú Lợi, Quận 8 với diện tích 240m² (ngang 10m, dài 24m). Sổ hồng riêng chính chủ, đất biệt thự đơn lập, được phép xây dựng 1 trệt 2 lầu và 1 áp mái, tổng diện tích sàn lên đến 448m².

Nền đất nằm hướng Đông Bắc, với giá bán 37 triệu/m². Vị trí đắc địa trong khu quy hoạch Phú Lợi, chỉ cách trung tâm Quận 1 khoảng 4km, được bao quanh bởi sông Cần Giuộc và có lộ giới 30m với đường nhựa lớn, bằng phẳng. Khu vực tập trung nhiều biệt thự sang trọng của cư dân từ Sài Gòn và Hà Nội.

Dân trí cao với nhiều cán bộ công nhân viên chức, bác sĩ, luật sư, giáo viên và doanh nhân sinh sống. Tỷ lệ cư dân đạt trên 80%, tạo nên một cộng đồng văn minh và ổn định.

Nền đất này rất phù hợp để xây dựng biệt thự nghỉ dưỡng hoặc homestay kinh doanh. Với vị trí ven sông, không khí luôn mát mẻ và thoáng đãng. Trong tương lai, với sự phát triển của chợ và trường đại học trong khu vực, Phú Lợi hứa hẹn sẽ trở thành trung tâm phía Tây Nam thành phố. Đặc biệt, việc quy hoạch trục đường vành đai 2 đi qua dự án sẽ gia tăng khả năng giao thương và giá trị bất động sản.

Nếu bạn quan tâm, hãy liên hệ với tôi qua số điện thoại 0932 113  để được dẫn đi xem thực tế dự án.",,240 m2,ho_chi_minh,Quận 8,Phường 7,16/10/2025,4,4,3,https://bds.com.vn/chinh-chu-dang-vay-ngan-hang-can-ban-gap-nen-biet-thu-ven-song-q8-co-so-rieng-ban-cat-lo-2-ty-p611272.html,2025-12-15T16:29:23.819791,ho_chi_minh,2025,10,2025-10-16T00:00:00,,240.0,2025-10-16,"chính chủ đang vay ngân hàng cần bán gấp nền biệt thự ven sông q8, có sổ riêng, bán cắt lỗ 2 tỷ",ho_chi_minh,Quận 8,Phường 7,,0,1,1,2,ba70e5631ec644d3bdfdf3fff9389f99
"Hiếm ! Đường Láng, lô góc, ở ngay, 3gác tránh, gần phố, 42m*6 tầng. Chỉ 8.85 tỷ.","Bán nhà lô góc tại khu vực Đường Láng, Quận Đống Đa, với vị trí đắc địa, chỉ vài bước chân là đến ngã tư Sở. Ngõ thông thoáng, xe 3 gác tránh nhau dễ dàng, không gian sống yên tĩnh nhưng gần trung tâm.

Căn nhà có diện tích 42m², mặt tiền 4.7m, được xây dựng 6 tầng khung cột vững chãi. Với thiết kế lô góc, căn nhà luôn tràn ngập ánh sáng tự nhiên, mang đến không gian sống thoáng đãng và tiện nghi. Nội thất cao cấp được tặng lại cho khách mua thiện chí.

Giá chào chỉ 8.85 tỷ (có thương lượng).

Khu vực xung quanh đầy đủ tiện ích cho cuộc sống hàng ngày: chợ, trường học chất lượng cao, bến xe bus, ga tàu điện, công viên, bệnh viện, và trung tâm thương mại.

Cấu trúc nhà gồm:
- Tầng 1: Phòng khách siêu rộng.
- Tầng 2: Khu bếp ăn thiết kế hiện đại với đồ nội thất cao cấp.
- Tầng 3, 4, 5: Mỗi tầng là một phòng ngủ rộng, có vệ sinh khép kín.
- Tầng 6: Phòng thờ và sân phơi.

Sổ đỏ vuông vắn, giao dịch ngay.

Liên hệ xem nhà ngay hôm nay: 0919922358 (Tài nhà đất).",8.85 tỷ,42 m2,ha_noi,Quận Đống Đa,Phường Ngã Tư Sở,16/10/2025,3,5,6,https://bds.com.vn/hiem--duong-lang-lo-goc-o-ngay-3gac-tranh-gan-pho-42m6-tang-chi-885-ty-p616437.html,2025-12-15T22:49:34.960861,ha_noi,2025,10,2025-10-16T00:00:00,8850000000.0,42.0,2025-10-16,"hiếm ! đường láng, lô góc, ở ngay, 3gác tránh, gần phố, 42m*6 tầng. chỉ 8.85 tỷ.",ha_noi,Quận Đống Đa,Phường Ngã Tư Sở,210714285.7142857,1,1,1,3,bf92fcff217ed4d02f52830ba9392dab
"Nhà Cực Đep Ở Ngay Âu Cơ-Tân Bình,HXH ,98M2,Ngang 5x19.6, Giá 8,6 Tỷ","Kẹt xoay KD nên bán nhanh,TL tốt với khách thiện chí Đất NỞ HẬU - HXH CÁCH MT 6 Căn ra Âu Cơ 50m,THẲNG 1 TRỤC Nhà Trệt,lửng,lầu+ 4PN, phòng khách+ khu bếp rộng + Hẻm thẳng đẹp dân trí,an ninh,Mọi tiện ích,Trường Cấp 1+2,Sát chợ,bệnh viện Tân Phú + Vị trí ngay,trần văn quang, Âu Cơ & Lạc Long Quân, giáp Quận 10,q11,Quận 3,Tân Phú + Sổ Đẹp ,đất nở hậu TÀI LỘC Xem nhà LH: A Phát Gặp chính chủ,( miễn tiếp lái)mọi thông tin chính xác",8.6 tỷ,98 m2,ho_chi_minh,Quận Tân Bình,Phường 10,16/10/2025,4,3,2,https://bds.com.vn/nha-cuc-dep-o-ngay-au-co-tan-binhhxh-98m2ngang-5x196-gia-86-ty-p486711.html,2025-12-15T16:31:14.472790,ho_chi_minh,2025,10,2025-10-16T00:00:00,8600000000.0,98.0,2025-10-16,"nhà cực đep ở ngay âu cơ-tân bình,hxh ,98m2,ngang 5x19.6, giá 8,6 tỷ",ho_chi_minh,Quận Tân Bình,Phường 10,87755102.04081632,1,1,1,3,c05270130df49bbc19315a6064ca49fa
NHÀ 4 TẦNG MẶT TIỀN NHỰA KHU DÂN CƯ TÊN LỬA PHƯỜNG BÌNH TRỊ ĐÔNG B QUẬN BÌNH TÂN. GIÁ DƯỚI 11 TỶ.,"KHU DÂN CƯ TÊN LỬA – BÌNH TRỊ ĐÔNG B -  BÌNH TÂN.
+ Diện tích: 100m2.
+ Kết cấu: 1 trệt + 2 lầu + sân thượng. Trước dịch chủ đang kinh doanh nhà nghĩ, có 9 PN, 10 WC.
+ Giá chỉ 10.5 tỷ.+ Khu phân lô đồng bộ, 2 phút di chuyển ra AEON Bình tân, Đường Tên Lửa, Kinh dương vương, An Dương Vương.
+ Sổ vuông đẹp công chứng ngay.
++ Liên hệ 0869 237 168 Mr. Nhân ( Có Zalo) để được xem nhà miễn phí.",10.5 tỷ,100 m2,ho_chi_minh,Quận Bình Tân,Bình Trị Đông B,16/10/2025,9,10,4,https://bds.com.vn/nha-4-tang-mat-tien-nhua-khu-dan-cu-ten-lua-phuong-binh-tri-dong-b-quan-binh-tan-gia-duoi-11-ty-p462253.html,2025-12-15T16:30:31.886764,ho_chi_minh,2025,10,2025-10-16T00:00:00,10500000000.0,100.0,2025-10-16,nhà 4 tầng mặt tiền nhựa khu dân cư tên lửa phường bình trị đông b quận bình tân. giá dưới 11 tỷ.,ho_chi_minh,Quận Bình Tân,Bình Trị Đông B,105000000.0,1,1,1,3,c4dcadbafe5a51784cda491aaad2af66
"Biệt thự Huỳnh Văn Bánh 4 tầng.Sát mặt tiền. DT 91m2{7,2 x 13} chỉ 12.5 tỷ. ĐT 0794285869","Tôi đang cho thuê một căn nhà tuyệt đẹp nằm ngay sát mặt tiền khu vực VÍP Phú Nhuận, chỉ mất 5 phút để di chuyển đến các quận trung tâm, gần phố Ẩm thực Phan Xích Long và Bệnh viện Hoàn Mỹ. Đặc biệt, bạn chỉ cần 10 phút để đến sân bay.

Căn nhà tọa lạc trong hẻm sạch sẽ, an ninh và gần mặt tiền đường. Nội thất bên trong được thiết kế cao cấp với cầu thang ốp gỗ đỏ và cửa gỗ óc chó nguyên khối, mang đến vẻ sang trọng và ấm cúng. Với thiết kế hiện đại, căn nhà có 5 phòng ngủ và 4 nhà vệ sinh, trong đó có một phòng master thoải mái.

Sân thượng rộng rãi, được bố trí phòng xông hơi nước và khô riêng biệt, rất lý tưởng để thư giãn. Ngoài ra, sân còn đủ chỗ để 6 chiếc xe máy, cùng với 2 giếng trời giúp không gian luôn thoáng đãng và tràn ngập ánh sáng tự nhiên.

Sổ hồng vuông vức, hoàn công đầy đủ, không có lỗi phong thủy, sẵn sàng công chứng ngay.",12.50 tỷ,91 m2,ho_chi_minh,Quận Phú Nhuận,Phường 12,16/10/2025,6,6,4,https://bds.com.vn/biet-thu-huynh-van-banh-4-tangsat-mat-tien-dt-91m2%7B72-x-13%7D-chi-125-ty-dt-0794285869-p608887.html,2025-12-15T16:30:02.359264,ho_chi_minh,2025,10,2025-10-16T00:00:00,12500000000.0,91.0,2025-10-16,"biệt thự huỳnh văn bánh 4 tầng.sát mặt tiền. dt 91m2{7,2 x 13} chỉ 12.5 tỷ. đt 0794285869",ho_chi_minh,Quận Phú Nhuận,Phường 12,137362637.36263737,1,1,1,3,c4e5efeb30d65cb77ab006b83edef450
"Nhà tân cổ điển, đẳng cấp sang trọng phố Thái Hà, Đống Đa, 44m2 x 5 tấng, 18.5 tỷ","Nhà tân cổ điển sang trọng trên phố Thái Hà, Đống Đa, với diện tích 44m2 và 5 tầng, đang chờ đón chủ nhân mới với mức giá 18.5 tỷ.

Vị trí đắc địa, phố Thái Hà là nơi tập trung nhiều thương hiệu lớn trong lĩnh vực điện tử và thời trang, mang đến những tiện ích đa dạng cho cư dân. Trước nhà có đường ô tô tránh, thuận lợi cho kinh doanh và tạo ra nguồn thu nhập ổn định.

Chỉ mất vài phút để di chuyển đến hồ Hoàn Kiếm, và dễ dàng tiếp cận các quận Bắc Nam Từ Liêm, Thanh Xuân, Cầu Giấy. Sổ đỏ vuông vắn, an toàn và dễ dàng giao dịch.

Liên hệ ngay với tôi để được tư vấn tận tình. Mr Mạnh 0866363866.",18.5 tỷ,44 m2,ha_noi,Quận Đống Đa,Phường Láng Thượng,16/10/2025,5,5,5,https://bds.com.vn/nha-tan-co-dien-dang-cap-sang-trong-pho-thai-ha-dong-da-44m2-x-5-tang-185-ty-p616473.html,2025-12-15T22:46:05.255405,ha_noi,2025,10,2025-10-16T00:00:00,18500000000.0,44.0,2025-10-16,"nhà tân cổ điển, đẳng cấp sang trọng phố thái hà, đống đa, 44m2 x 5 tấng, 18.5 tỷ",ha_noi,Quận Đống Đa,Phường Láng Thượng,420454545.45454544,1,1,1,3,c5bba79f548a96dc1681f70deae770fa
"Bán nhanh CCMN Cầu Giấy 7 tầng x 11 phòng khép kín, dòng tiền 55tr, giá 6.88 tỉ","CHUNG CƯ MINI CẦU GIẤY 43M2 x 7 TẦNG - 11 PHÒNG CAO CẤP KHÉP KÍN NGUYÊN BẢN SẴN TỪ ĐẦU - DÒNG TIỀN 55 TRIỆU/ THÁNG - KHU VIP, CÁC TRƯỜNG ĐẠI HỌC BỦA VÂY - CHỐT TRONG NGÀY!",6.88 tỷ,43 m2,ha_noi,Quận Cầu Giấy,Phường Mai Dịch,16/10/2025,11,11,7,https://bds.com.vn/ban-nhanh-ccmn-cau-giay-7-tang-x-11-phong-khep-kin-dong-tien-55tr-gia-688-ti-p472069.html,2025-12-15T22:46:52.219782,ha_noi,2025,10,2025-10-16T00:00:00,6880000000.0,43.0,2025-10-16,"bán nhanh ccmn cầu giấy 7 tầng x 11 phòng khép kín, dòng tiền 55tr, giá 6.88 tỉ",ha_noi,Quận Cầu Giấy,Phường Mai Dịch,160000000.0,1,1,1,3,c5f5cac27600e038be5e617d084ad488
Nhà mới Lê Văn Sỹ Q.3 Sát Chợ NV Trỗi - 48m2 Vuông A4 - 3 Tầng 3PN - Nhỉnh 7 tỷ,"HÀNG HIẾM MUA NGAY - CHUẨN HOA HẬU - VÍP Q3 -DIỆN TÍCH 4x12m - 48m2- SÁT XE HƠI - SÁT MẶT TIỀN - BÃI GIỮ XE HƠI CƯ XÁ CÁCH 15M
+ Địa chỉ: Lê Văn Sỹ, Phường 13 Quận 3.- Ngay chợ Nguyễn Văn Trỗi, Chung cư Trần Quang Diệu.- Hẻm đẹp thông, sát xe hơi, sát mặt tiền. 2 mặt tiền trước sau cực thoáng.- Nhà đẹp 3 tầng, 3 phòng ngủ, ban công. Nội thất đẹp đầy đủ.- Pháp lý sạch 100%, vuông vức, công chứng ngay.AlO Ngư xem nhà gặp chính chủ thương lượng.",7.799 tỷ,48 m2,ho_chi_minh,Quận 3,Phường 13,16/10/2025,3,3,3,https://bds.com.vn/nha-moi-le-van-sy-q3-sat-cho-nv-troi---48m2-vuong-a4---3-tang-3pn---nhinh-7-ty-p484040.html,2025-12-15T16:31:35.711933,ho_chi_minh,2025,10,2025-10-16T00:00:00,7799000000.0,48.0,2025-10-16,nhà mới lê văn sỹ q.3 sát chợ nv trỗi - 48m2 vuông a4 - 3 tầng 3pn - nhỉnh 7 tỷ,ho_chi_minh,Quận 3,Phường 13,162479166.66666666,1,1,1,3,c7f8afce0277aa14ec24c9d2a5879a98
"SỐC! Nhà đẹp Đại Từ, Hoàng Mai 4,5 tầng 4 ngủ chỉ 2,6 tỷ - Ở NGAY - FULL NỘI THẤT - YÊN TĨNH - Ở SƯỚNG 0928077333","SỐC! CHỈ VỚI 2,6 TỶ BẠN ĐÃ CÓ NGAY 1 CĂN NHÀ 4,5 TẦNG- Ở NGAY - FULL NỘI THẤT - YÊN TĨNH - GẦN CHỢ, TRƯỜNG HỌC - Ở SIÊU SƯỚNG.
+ Diện tích: 30m
+ Giá chào: 2,6 tỷ có gia lộc.
+ Nằm trong con ngõ thông thoáng sạch sẽ, hàng xóm hiền lành, anh ninh tốt.
+ Nhà sát trường học mầm non, cách chợ và trường học cấp 1,2 rất gần.
+ Nhà mới xây ở được 2 năm nên rất mới, chủ tặng lại 90% nội thất cho khách thiện trí.
+ Thông các tuyến Nguyễn Hữu Thọ, Giải Phóng, Kim Giang, Nguyễn Xiển, Bằng Liệt,.... cách bến xe Giáp Bát, Nước Ngầm chỉ vài phút đi xe máy.
+ Sổ đỏ đẹp cất két sẵn sàng giao dịch.
+ Liên hệ Ms Hương 0928077333 chuyên BĐS thổ cư uy tín, tận tâm, xem nhà miễn phí 24/7.",2.6 tỷ,30 m2,ha_noi,Quận Hoàng Mai,Phường Đại Kim,16/10/2025,3,4,4,https://bds.com.vn/soc-nha-dep-dai-tu-hoang-mai-45-tang-4-ngu-chi-26-ty---o-ngay---full-noi-that---yen-tinh---o-suong-0928077333-p466516.html,2025-12-15T22:47:00.544247,ha_noi,2025,10,2025-10-16T00:00:00,2600000000.0,30.0,2025-10-16,"sốc! nhà đẹp đại từ, hoàng mai 4,5 tầng 4 ngủ chỉ 2,6 tỷ - ở ngay - full nội thất - yên tĩnh - ở sướng 0928077333",ha_noi,Quận Hoàng Mai,Phường Đại Kim,86666666.66666667,1,1,1,3,c95e9e0c7ff9cb9f3b5d3727ebcdce93
"THIỆN CHÍ BÁN NHANH - CĂN GÓC CỰC ĐẸP – Nhà đẹp Nguyễn Chí Thanh, Đống Đa 45m2 x 5tầng-20 tỷ","Cần bán nhanh căn góc đẹp tại phố Nguyễn Chí Thanh, Đống Đa. Diện tích 45m2, xây dựng 5 tầng, giá 20 tỷ.

Sổ vuông vắn, ô tô tránh nhau thoải mái, rất thích hợp cho việc kinh doanh. Vị trí đắc địa, nằm trong khu vực trung tâm sầm uất của Hà Nội, gần nhiều trường đại học lớn, cơ quan và bệnh viện, mang đến sự thuận tiện tối đa cho cuộc sống hàng ngày.

Khu vực xung quanh thoáng đãng, yên tĩnh với hàng xóm thân thiện và ngăn nắp. Ngôi nhà được xây dựng kiên cố, sẵn sàng để kinh doanh hoặc cho thuê, tạo nguồn thu nhập ổn định.

Chủ nhà là người quen, vui lòng liên hệ với tôi qua số điện thoại 0866363866 để biết thêm chi tiết.",20 tỷ,42 m2,ha_noi,Quận Đống Đa,Phường Láng Thượng,16/10/2025,6,5,5,https://bds.com.vn/thien-chi-ban-nhanh---can-goc-cuc-dep-%E2%80%93-nha-dep-nguyen-chi-thanh-dong-da-45m2-x-5tang-20-ty-p616490.html,2025-12-15T22:49:46.954838,ha_noi,2025,10,2025-10-16T00:00:00,20000000000.0,42.0,2025-10-16,"thiện chí bán nhanh - căn góc cực đẹp – nhà đẹp nguyễn chí thanh, đống đa 45m2 x 5tầng-20 tỷ",ha_noi,Quận Đống Đa,Phường Láng Thượng,476190476.1904762,1,1,1,3,cafbd43d86a90820e2bfe9ecb5e33369
"Bán nhà riêng hẻm xe tải 3 tầng Phạm Hùng 4 x 12 Bình Hưng  Bình Chánh chỉ 3,3 tỷ","Nhà riêng hẻm xe tải 3 tầng đường Phạm Hùng, diện tích 4 x 12m, chỉ 3,3 tỷ.

Ngôi nhà nằm trong khu dân cư đồng bộ, an ninh, hẻm ô tô tải thuận tiện di chuyển. Thiết kế 1 trệt, 1 lầu và sân thượng, bao gồm phòng khách rộng rãi và 3 phòng ngủ thoáng mát.

Vị trí đắc địa, gần Nguyễn Văn Linh, chỉ mất 5 phút đến Phú Mỹ Hưng, thuận lợi cho việc di chuyển. Xung quanh có đầy đủ tiện ích như trường học, bệnh viện...

Nhà được mua bán giấy tay, chủ nhà đã ở lâu năm, có đầy đủ giấy tờ chính chủ và thông tin khai thuế.",3.3 tỷ,48 m2,ho_chi_minh,Quận 8,Phường 16,16/10/2025,4,4,3,https://bds.com.vn/ban-nha-rieng-hem-xe-tai-3-tang-pham-hung-4-x-12-binh-hung--binh-chanh-chi-33-ty-p611482.html,2025-12-15T22:50:54.017173,ho_chi_minh,2025,10,2025-10-16T00:00:00,3300000000.0,48.0,2025-10-16,"bán nhà riêng hẻm xe tải 3 tầng phạm hùng 4 x 12 bình hưng  bình chánh chỉ 3,3 tỷ",ho_chi_minh,Quận 8,Phường 16,68750000.0,1,1,1,3,cb247a4ded6b01c1a097eab93f3c1d0e
Bán nhà Tân Mai Hoàng Mai 28m 5 tầng 3 ngủ ngõ thông ô tô kinh doanh chỉ 4 tỷ lh 0817606560,"Bán nhà tại Tân Mai, Hoàng Mai, diện tích 28m², 5 tầng, 3 phòng ngủ, ngõ thông ô tô, phù hợp với kinh doanh, chỉ 4 tỷ, liên hệ 0817606560.

Đây là một cơ hội tuyệt vời với vị trí đắc địa, ngõ thông rộng rãi, ô tô có thể tránh nhau và dừng đỗ thoải mái suốt cả ngày. Nhà lô góc với hai mặt thoáng, rất lý tưởng cho việc kinh doanh hoặc làm văn phòng, spa...

Thiết kế nhà rất hợp lý:
- Tầng 1: Khu vực kinh doanh và bếp.
- Tầng 2, 3, 4: Mỗi tầng gồm 1 phòng ngủ và vệ sinh riêng.
- Tầng 5: Sân phơi rộng rãi.

Nhà đã được trang bị đầy đủ nội thất, chỉ cần xách vali đến ở ngay. Hãy nhanh tay để sở hữu căn nhà lý tưởng này!",4 tỷ,28 m2,ha_noi,Quận Hoàng Mai,Phường Tân Mai,16/10/2025,3,3,5,https://bds.com.vn/ban-nha-tan-mai-hoang-mai-28m-5-tang-3-ngu-ngo-thong-o-to-kinh-doanh-chi-4-ty-lh-0817606560-p616287.html,2025-12-15T22:46:19.330222,ha_noi,2025,10,2025-10-16T00:00:00,4000000000.0,28.0,2025-10-16,bán nhà tân mai hoàng mai 28m 5 tầng 3 ngủ ngõ thông ô tô kinh doanh chỉ 4 tỷ lh 0817606560,ha_noi,Quận Hoàng Mai,Phường Tân Mai,142857142.85714287,1,1,1,3,ccf4bc714b7bcd857423e4ee7481e324
